{
  "agentFindings": {
    "psa-reviewer": {
      "status": "COMPLETE",
      "finding": "PSA reviewed and deadlines calendared."
    },
    "loan-doc-reviewer": {
      "status": "COMPLETE",
      "finding": "Loan docs align with selected financing terms."
    },
    "title-survey-reviewer": {
      "status": "COMPLETE",
      "finding": "Title and survey package clear."
    },
    "estoppel-tracker": {
      "status": "COMPLETE",
      "finding": "153/180 estoppels collected.",
      "total": 180,
      "received": 153,
      "returnRate": 0.85,
      "minimumRequired": 0.8,
      "discrepancies": 9,
      "discrepancyNote": "Discrepancies concentrated in concessions and lease dates."
    },
    "insurance-coordinator": {
      "status": "COMPLETE",
      "finding": "Primary insurance coverages bound.",
      "policies": [
        {
          "type": "General Liability",
          "annual": 164136
        },
        {
          "type": "Property",
          "annual": 306651
        },
        {
          "type": "Umbrella",
          "annual": 86736
        }
      ],
      "totalAnnualPremium": 557523,
      "perUnit": 2788
    },
    "transfer-doc-preparer": {
      "status": "COMPLETE",
      "finding": "Transfer package complete for signature routing.",
      "documents": [
        "Deed",
        "Bill of Sale",
        "Assignment of Leases",
        "Tenant Notices",
        "FIRPTA Certificate"
      ]
    }
  },
  "psaStatus": {
    "reviewStatus": "REVIEWED"
  },
  "titleStatus": {
    "status": "CLEAR"
  },
  "estoppelStatus": {
    "returnRate": 0.85
  },
  "insuranceStatus": {
    "overallStatus": "ALL_BOUND"
  },
  "transferDocStatus": {
    "overallReadiness": "READY"
  },
  "closingChecklistStatus": {
    "preClosingItems": {
      "completed": 18,
      "total": 18
    },
    "closingDayItems": {
      "completed": 9,
      "total": 11
    },
    "postClosingItems": {
      "identified": 4,
      "total": 6
    },
    "criticalPathItems": [
      "Rate lock confirmation"
    ]
  },
  "riskScore": 82,
  "redFlagCount": 0,
  "dataGapCount": 0,
  "redFlags": [],
  "dataGaps": []
}